query_id,user_input,retrieved_contexts,reference,response
1,0-dimensional biomaterials show inductive properties.,"['Mechanical regulation of cell function with geometrically modulated elastomeric substrates We report the establishment of a library of micromolded elastomeric micropost arrays to modulate substrate rigidity independently of effects on adhesive and other material surface properties. We demonstrated that micropost rigidity impacts cell morphology, focal adhesions, cytoskeletal contractility and stem cell differentiation. Furthermore, early changes in cytoskeletal contractility predicted later stem cell fate decisions in single cells.', 'Nonlinear Elasticity in Biological Gels Unlike most synthetic materials, biological materials often stiffen as they are deformed. This nonlinear elastic response, critical for the physiological function of some tissues, has been documented since at least the 19th century, but the molecular structure and the design principles responsible for it are unknown. Current models for this response require geometrically complex ordered structures unique to each material. In this Article we show that a much simpler molecular theory accounts for strain stiffening in a wide range of molecularly distinct biopolymer gels formed from purified cytoskeletal and extracellular proteins. This theory shows that systems of semi-flexible chains such as filamentous proteins arranged in an open crosslinked meshwork invariably stiffen at low strains without the need for a specific architecture or multiple elements with different intrinsic stiffnesses.', 'Layered hydrogels accelerate iPSC-derived neuronal maturation and reveal migration defects caused by MeCP2 dysfunction. Probing a wide range of cellular phenotypes in neurodevelopmental disorders using patient-derived neural progenitor cells (NPCs) can be facilitated by 3D assays, as 2D systems cannot entirely recapitulate the arrangement of cells in the brain. Here, we developed a previously unidentified 3D migration and differentiation assay in layered hydrogels to examine how these processes are affected in neurodevelopmental disorders, such as Rett syndrome. Our soft 3D system mimics the brain environment and accelerates maturation of neurons from human induced pluripotent stem cell (iPSC)-derived NPCs, yielding electrophysiologically active neurons within just 3 wk. Using this platform, we revealed a genotype-specific effect of methyl-CpG-binding protein-2 (MeCP2) dysfunction on iPSC-derived neuronal migration and maturation (reduced neurite outgrowth and fewer synapses) in 3D layered hydrogels. Thus, this 3D system expands the range of neural phenotypes that can be studied in vitro to include those influenced by physical and mechanical stimuli or requiring specific arrangements of multiple cell types.', 'Geometric cues for directing the differentiation of mesenchymal stem cells. Significant efforts have been directed to understanding the factors that influence the lineage commitment of stem cells. This paper demonstrates that cell shape, independent of soluble factors, has a strong influence on the differentiation of human mesenchymal stem cells (MSCs) from bone marrow. When exposed to competing soluble differentiation signals, cells cultured in rectangles with increasing aspect ratio and in shapes with pentagonal symmetry but with different subcellular curvature-and with each occupying the same area-display different adipogenesis and osteogenesis profiles. The results reveal that geometric features that increase actomyosin contractility promote osteogenesis and are consistent with in vivo characteristics of the microenvironment of the differentiated cells. Cytoskeletal-disrupting pharmacological agents modulate shape-based trends in lineage commitment verifying the critical role of focal adhesion and myosin-generated contractility during differentiation. Microarray analysis and pathway inhibition studies suggest that contractile cells promote osteogenesis by enhancing c-Jun N-terminal kinase (JNK) and extracellular related kinase (ERK1/2) activation in conjunction with elevated wingless-type (Wnt) signaling. Taken together, this work points to the role that geometric shape cues can play in orchestrating the mechanochemical signals and paracrine/autocrine factors that can direct MSCs to appropriate fates.', 'Complex Tissue and Disease Modeling using hiPSCs. Defined genetic models based on human pluripotent stem cells have opened new avenues for understanding disease mechanisms and drug screening. Many of these models assume cell-autonomous mechanisms of disease but it is possible that disease phenotypes or drug responses will only be evident if all cellular and extracellular components of a tissue are present and functionally mature. To derive optimal benefit from such models, complex multicellular structures with vascular components that mimic tissue niches will thus likely be necessary. Here we consider emerging research creating human tissue mimics and provide some recommendations for moving the field forward.']","New opportunities: the use of nanotechnologies to manipulate and track stem cells.: Nanotechnologies are emerging platforms that could be useful in measuring, understanding, and manipulating stem cells. Examples include magnetic nanoparticles and quantum dots for stem cell labeling and in vivo tracking; nanoparticles, carbon nanotubes, and polyplexes for the intracellular delivery of genes/oligonucleotides and protein/peptides; and engineered nanometer-scale scaffolds for stem cell differentiation and transplantation. This review examines the use of nanotechnologies for stem cell tracking, differentiation, and transplantation. We further discuss their utility and the potential concerns regarding their cytotoxicity.","The provided contexts do not mention 0-dimensional biomaterials or their inductive properties. Therefore, the evidence is insufficient to answer the question."
3,"1,000 genomes project enables mapping of genetic sequence variation consisting of rare variants with larger penetrance effects than common variants.","['Rare and common variants: twenty arguments Genome-wide association studies have greatly improved our understanding of the genetic basis of disease risk. The fact that they tend not to identify more than a fraction of the specific causal loci has led to divergence of opinion over whether most of the variance is hidden as numerous rare variants of large effect or as common variants of very small effect. Here I review 20 arguments for and against each of these models of the genetic basis of complex traits and conclude that both classes of effect can be readily reconciled.', 'A fine-scale map of recombination rates and hotspots across the human genome. Genetic maps, which document the way in which recombination rates vary over a genome, are an essential tool for many genetic analyses. We present a high-resolution genetic map of the human genome, based on statistical analyses of genetic variation data, and identify more than 25,000 recombination hotspots, together with motifs and sequence contexts that play a role in hotspot activity. Differences between the behavior of recombination rates over large (megabase) and small (kilobase) scales lead us to suggest a two-stage model for recombination in which hotspots are stochastic features, within a framework in which large-scale rates are constrained.', ""Common and rare variants in multifactorial susceptibility to common diseases Here, we give a historical overview of the search for genetic variants that influence the susceptibility of an individual to a chronic disease, from RA Fisher's seminal work to the current excitement of whole-genome association studies (WGAS). We then discuss the concepts behind the identification of common variants as disease causal factors and contrast them to the basic ideas that underlie the rare variant hypothesis. The identification of rare variants involves the careful selection of candidate genes to examine, the availability of highly efficient resequencing techniques and the appropriate assessment of the functional consequences of the implicated variant. We believe that this strategy can be successfully applied at present in order to unravel the contribution of rare variants to the multifactorial inheritance of common diseases, which could lead to the implementation of much needed preventative screening schemes."", 'Rare Variants Create Synthetic Genome-Wide Associations Genome-wide association studies (GWAS) have now identified at least 2,000 common variants that appear associated with common diseases or related traits (http://www.genome.gov/gwastudies), hundreds of which have been convincingly replicated. It is generally thought that the associated markers reflect the effect of a nearby common (minor allele frequency >0.05) causal site, which is associated with the marker, leading to extensive resequencing efforts to find causal sites. We propose as an alternative explanation that variants much less common than the associated one may create ""synthetic associations"" by occurring, stochastically, more often in association with one of the alleles at the common site versus the other allele. Although synthetic associations are an obvious theoretical possibility, they have never been systematically explored as a possible explanation for GWAS findings. Here, we use simple computer simulations to show the conditions under which such synthetic associations will arise and how they may be recognized. We show that they are not only possible, but inevitable, and that under simple but reasonable genetic models, they are likely to account for or contribute to many of the recently identified signals reported in genome-wide association studies. We also illustrate the behavior of synthetic associations in real datasets by showing that rare causal mutations responsible for both hearing loss and sickle cell anemia create genome-wide significant synthetic associations, in the latter case extending over a 2.5-Mb interval encompassing scores of ""blocks"" of associated variants. In conclusion, uncommon or rare genetic variants can easily create synthetic associations that are credited to common variants, and this possibility requires careful consideration in the interpretation and follow up of GWAS signals.', 'Circos: an information aesthetic for comparative genomics. We created a visualization tool called Circos to facilitate the identification and analysis of similarities and differences arising from comparisons of genomes. Our tool is effective in displaying variation in genome structure and, generally, any other kind of positional relationships between genomic intervals. Such data are routinely produced by sequence alignments, hybridization arrays, genome mapping, and genotyping studies. Circos uses a circular ideogram layout to facilitate the display of relationships between pairs of positions by the use of ribbons, which encode the position, size, and orientation of related genomic elements. Circos is capable of displaying data as scatter, line, and histogram plots, heat maps, tiles, connectors, and text. Bitmap or vector images can be created from GFF-style data inputs and hierarchical configuration files, which can be easily generated by automated tools, making Circos suitable for rapid deployment in data analysis and reporting pipelines.']","Rare Variants Create Synthetic Genome-Wide Associations: Genome-wide association studies (GWAS) have now identified at least 2,000 common variants that appear associated with common diseases or related traits (http://www.genome.gov/gwastudies), hundreds of which have been convincingly replicated. It is generally thought that the associated markers reflect the effect of a nearby common (minor allele frequency >0.05) causal site, which is associated with the marker, leading to extensive resequencing efforts to find causal sites. We propose as an alternative explanation that variants much less common than the associated one may create ""synthetic associations"" by occurring, stochastically, more often in association with one of the alleles at the common site versus the other allele. Although synthetic associations are an obvious theoretical possibility, they have never been systematically explored as a possible explanation for GWAS findings. Here, we use simple computer simulations to show the conditions under which such synthetic associations will arise and how they may be recognized. We show that they are not only possible, but inevitable, and that under simple but reasonable genetic models, they are likely to account for or contribute to many of the recently identified signals reported in genome-wide association studies. We also illustrate the behavior of synthetic associations in real datasets by showing that rare causal mutations responsible for both hearing loss and sickle cell anemia create genome-wide significant synthetic associations, in the latter case extending over a 2.5-Mb interval encompassing scores of ""blocks"" of associated variants. In conclusion, uncommon or rare genetic variants can easily create synthetic associations that are credited to common variants, and this possibility requires careful consideration in the interpretation and follow up of GWAS signals.","The provided contexts do not directly mention the 1,000 Genomes Project or its specific contributions to mapping rare variants with larger penetrance effects compared to common variants. While Contexts 1, 3, and 4 discuss the roles and identification of rare and common variants in genetic studies, they do not provide evidence specific to the 1,000 Genomes Project and its"
5,1/2000 in UK have abnormal PrP positivity.,"['Prevalent abnormal prion protein in human appendixes after bovine spongiform encephalopathy epizootic: large scale survey OBJECTIVES To carry out a further survey of archived appendix samples to understand better the differences between existing estimates of the prevalence of subclinical infection with prions after the bovine spongiform encephalopathy epizootic and to see whether a broader birth cohort was affected, and to understand better the implications for the management of blood and blood products and for the handling of surgical instruments. DESIGN Irreversibly unlinked and anonymised large scale survey of archived appendix samples. SETTING Archived appendix samples from the pathology departments of 41 UK hospitals participating in the earlier survey, and additional hospitals in regions with lower levels of participation in that survey. SAMPLE 32,441 archived appendix samples fixed in formalin and embedded in paraffin and tested for the presence of abnormal prion protein (PrP). RESULTS Of the 32,441 appendix samples 16 were positive for abnormal PrP, indicating an overall prevalence of 493 per million population (95% confidence interval 282 to 801 per million). The prevalence in those born in 1941-60 (733 per million, 269 to 1596 per million) did not differ significantly from those born between 1961 and 1985 (412 per million, 198 to 758 per million) and was similar in both sexes and across the three broad geographical areas sampled. Genetic testing of the positive specimens for the genotype at PRNP codon 129 revealed a high proportion that were valine homozygous compared with the frequency in the normal population, and in stark contrast with confirmed clinical cases of vCJD, all of which were methionine homozygous at PRNP codon 129. CONCLUSIONS This study corroborates previous studies and suggests a high prevalence of infection with abnormal PrP, indicating vCJD carrier status in the population compared with the 177 vCJD cases to date. These findings have important implications for the management of blood and blood products and for the handling of surgical instruments.', ""Patterns of chlamydia testing in different settings and implications for wider STI diagnosis and care: a probability sample survey of the British population BACKGROUND Following widespread rollout of chlamydia testing to non-specialist and community settings in the UK, many individuals receive a chlamydia test without being offered comprehensive STI and HIV testing. We assess sexual behaviour among testers in different settings with a view to understanding their need for other STI diagnostic services. METHODS A probability sample survey of the British population undertaken 2010-2012 (the third National Survey of Sexual Attitudes and Lifestyles). We analysed weighted data on chlamydia testing (past year), including location of most recent test, and diagnoses (past 5 years) from individuals aged 16-44 years reporting at least one sexual partner in the past year (4992 women, 3406 men). RESULTS Of the 26.8% (95% CI 25.4% to 28.2%) of women and 16.7% (15.5% to 18.1%) of men reporting a chlamydia test in the past year, 28.4% of women and 41.2% of men had tested in genitourinary medicine (GUM), 41.1% and 20.7% of women and men respectively tested in general practice (GP) and the remainder tested in other non-GUM settings. Women tested outside GUM were more likely to be older, in a relationship and to live in rural areas. Individuals tested outside GUM reported fewer risk behaviours; nevertheless, 11.0% (8.6% to 14.1%) of women and 6.8% (3.9% to 11.6%) of men tested in GP and 13.2% (10.2% to 16.8%) and 9.6% (6.5% to 13.8%) of women and men tested in other non-GUM settings reported 'unsafe sex', defined as two or more partners and no condom use with any partner in the past year. Individuals treated for chlamydia outside GUM in the past 5 years were less likely to report an HIV test in that time frame (women: 54.5% (42.7% to 65.7%) vs 74.1% (65.9% to 80.9%) in GUM; men: 23.9% (12.7% to 40.5%) vs 65.8% (56.2% to 74.3%)). CONCLUSIONS Most chlamydia testing occurred in non-GUM settings, among populations reporting fewer risk behaviours. However, there is a need to provide pathways to comprehensive STI care to the sizeable minority at higher risk."", 'Prevalence, risk factors, and uptake of interventions for sexually transmitted infections in Britain: findings from the National Surveys of Sexual Attitudes and Lifestyles (Natsal) BACKGROUND Population-based estimates of prevalence, risk distribution, and intervention uptake inform delivery of control programmes for sexually transmitted infections (STIs). We undertook the third National Survey of Sexual Attitudes and Lifestyles (Natsal-3) after implementation of national sexual health strategies, and describe the epidemiology of four STIs in Britain (England, Scotland, and Wales) and the uptake of interventions. METHODS Between Sept 6, 2010 and Aug 31, 2012 , we did a probability sample survey of 15,162 women and men aged 16-74 years in Britain. Participants were interviewed with computer-assisted face-to-face and self-completion questionnaires. Urine from a sample of participants aged 16-44 years who reported at least one sexual partner over the lifetime was tested for the presence of Chlamydia trachomatis, type-specific human papillomavirus (HPV), Neisseria gonorrhoeae, and HIV antibody. We describe age-specific and sex-specific prevalences of infection and intervention uptake, in relation to demographic and behavioural factors, and explore changes since Natsal-1 (1990-91) and Natsal-2 (1999-2001). FINDINGS Of 8047 eligible participants invited to provide a urine sample, 4828 (60%) agreed. We excluded 278 samples, leaving 4550 (94%) participants with STI test results. Chlamydia prevalence was 1·5% (95% CI 1·1-2·0) in women and 1·1% (0·7-1·6) in men. Prevalences in individuals aged 16-24 years were 3·1% (2·2-4·3) in women and 2·3% (1·5-3·4) in men. Area-level deprivation and higher numbers of partners, especially without use of condoms, were risk factors. However, 60·4% (45·5-73·7) of chlamydia in women and 43·3% (25·9-62·5) in men was in individuals who had had one partner in the past year. Among sexually active 16-24-year-olds, 54·2% (51·4-56·9) of women and 34·6% (31·8-37·4) of men reported testing for chlamydia in the past year, with testing higher in those with more partners. High-risk HPV was detected in 15·9% (14·4-17·5) of women, similar to in Natsal-2. Coverage of HPV catch-up vaccination was 61·5% (58·2-64·7). Prevalence of HPV types 16 and 18 in women aged 18-20 years was lower in Natsal-3 than Natsal-2 (5·8% [3·9-8·6] vs 11·3% [6·8-18·2]; age-adjusted odds ratio 0·44 [0·21-0·94]). Gonorrhoea (<0·1% prevalence in women and men) and HIV (0·1% prevalence in women and 0·2% in men) were uncommon and restricted to participants with recognised high-risk factors. Since Natsal-2, substantial increases were noted in attendance at sexual health clinics (from 6·7% to 21·4% in women and from 7·7% to 19·6% in men) and HIV testing (from 8·7% to 27·6% in women and from 9·2% to 16·9% in men) in the past 5 years. INTERPRETATION STIs were distributed heterogeneously, requiring general and infection-specific interventions. Increases in testing and attendance at sexual health clinics, especially in people at highest risk, are encouraging. However, STIs persist both in individuals accessing and those not accessing services. Our findings provide empirical evidence to inform future sexual health interventions and services. FUNDING Grants from the UK Medical Research Council and the Wellcome Trust, with support from the Economic and Social Research Council and the Department of Health.', 'Sporadic Creutzfeldt-Jakob disease in the United Kingdom: analysis of epidemiological surveillance data for 1970-96. OBJECTIVE To identify changes in the occurrence of Creutzfeldt-Jakob disease that might be related to the epidemic of bovine spongiform encephalopathy. DESIGN Epidemiological surveillance of the United Kingdom population for Creutzfeldt-Jakob disease based on (a) referral of suspected cases by neurologists, neuropathologists, and neurophysiologists and (b) death certificates. SETTING England and Wales during 1970-84, and whole of the United Kingdom during 1985-96. SUBJECTS All 662 patients identified as sporadic cases of Creutzfeldt-Jakob disease. MAIN OUTCOME MEASURES Age distribution of patients, age specific time trends of disease, occupational exposure to cattle, potential exposure to causative agent of bovine spongiform encephalopathy. RESULTS During 1970-96 there was an increase in the number of sporadic cases of Creutzfeldt-Jakob disease recorded yearly in England and Wales. The greatest increase was among people aged over 70. There was a statistically significant excess of cases among dairy farm workers and their spouses and among people at increased risk of contact with live cattle infected with bovine spongiform encephalopathy. During 1994-6 there were six deaths from sporadic Creutzfeldt-Jakob disease in the United Kingdom in patients aged under 30. CONCLUSIONS The increase in the incidence of sporadic Creutzfeldt-Jakob disease and the high incidence in dairy farmers in the United Kingdom may be unrelated to bovine spongiform encephalopathy. The most striking change in the pattern of Creutzfeldt-Jakob disease in the United Kingdom after the epidemic of bovine spongiform encephalopathy is provided by the incidence in a group of exceptionally young patients with a consistent and unusual neuropathological profile. The outcome of mouse transmission studies and the future incidence of the disease in the United Kingdom and elsewhere, will be important in judging whether the agent causing bovine spongiform encephalopathy has infected humans.', 'Study of infectious intestinal disease in England: rates in the community, presenting to general practice, and reported to national surveillance. The Infectious Intestinal Disease Study Executive. OBJECTIVE To establish the incidence and aetiology of infectious intestinal disease in the community and presenting to general practitioners. Comparison with incidence and aetiology of cases reaching national laboratory based surveillance. DESIGN Population based community cohort incidence study, general practice based incidence studies, and case linkage to national laboratory surveillance. SETTING 70 general practices throughout England. PARTICIPANTS 459 975 patients served by the practices. Community surveillance of 9776 randomly selected patients. MAIN OUTCOME MEASURES Incidence of infectious intestinal disease in community and reported to general practice. RESULTS 781 cases were identified in the community cohort, giving an incidence of 19.4/100 person years (95% confidence interval 18.1 to 20.8). 8770 cases presented to general practice (3.3/100 person years (2.94 to 3.75)). One case was reported to national surveillance for every 1.4 laboratory identifications, 6.2 stools sent for laboratory investigation, 23 cases presenting to general practice, and 136 community cases. The ratio of cases in the community to cases reaching national surveillance was lower for bacterial pathogens (salmonella 3.2:1, campylobacter 7.6:1) than for viruses (rotavirus 35:1, small round structured viruses 1562:1). There were many cases for which no organism was identified. CONCLUSIONS Infectious intestinal disease occurs in 1 in 5 people each year, of whom 1 in 6 presents to a general practitioner. The proportion of cases not recorded by national laboratory surveillance is large and varies widely by microorganism. Ways of supplementing the national laboratory surveillance system for infectious intestinal diseases should be considered.']","Prevalent abnormal prion protein in human appendixes after bovine spongiform encephalopathy epizootic: large scale survey: OBJECTIVES To carry out a further survey of archived appendix samples to understand better the differences between existing estimates of the prevalence of subclinical infection with prions after the bovine spongiform encephalopathy epizootic and to see whether a broader birth cohort was affected, and to understand better the implications for the management of blood and blood products and for the handling of surgical instruments. DESIGN Irreversibly unlinked and anonymised large scale survey of archived appendix samples. SETTING Archived appendix samples from the pathology departments of 41 UK hospitals participating in the earlier survey, and additional hospitals in regions with lower levels of participation in that survey. SAMPLE 32,441 archived appendix samples fixed in formalin and embedded in paraffin and tested for the presence of abnormal prion protein (PrP). RESULTS Of the 32,441 appendix samples 16 were positive for abnormal PrP, indicating an overall prevalence of 493 per million population (95% confidence interval 282 to 801 per million). The prevalence in those born in 1941-60 (733 per million, 269 to 1596 per million) did not differ significantly from those born between 1961 and 1985 (412 per million, 198 to 758 per million) and was similar in both sexes and across the three broad geographical areas sampled. Genetic testing of the positive specimens for the genotype at PRNP codon 129 revealed a high proportion that were valine homozygous compared with the frequency in the normal population, and in stark contrast with confirmed clinical cases of vCJD, all of which were methionine homozygous at PRNP codon 129. CONCLUSIONS This study corroborates previous studies and suggests a high prevalence of infection with abnormal PrP, indicating vCJD carrier status in the population compared with the 177 vCJD cases to date. These findings have important implications for the management of blood and blood products and for the handling of surgical instruments.","The evidence provided does not support the claim that 1/2000 in the UK have abnormal PrP positivity. According to Context [1], the prevalence of abnormal PrP positivity is 493 per million population, which translates to 0.0493%, or approximately 1/2028. While this figure is close to 1/200"
13,5% of perinatal mortality is due to low birth weight.,"[""Determinants of neonatal mortality in Indonesia BACKGROUND Neonatal mortality accounts for almost 40 per cent of under-five child mortality, globally. An understanding of the factors related to neonatal mortality is important to guide the development of focused and evidence-based health interventions to prevent neonatal deaths. This study aimed to identify the determinants of neonatal mortality in Indonesia, for a nationally representative sample of births from 1997 to 2002. METHODS The data source for the analysis was the 2002-2003 Indonesia Demographic and Health Survey from which survival information of 15,952 singleton live-born infants born between 1997 and 2002 was examined. Multilevel logistic regression using a hierarchical approach was performed to analyze the factors associated with neonatal deaths, using community, socio-economic status and proximate determinants. RESULTS At the community level, the odds of neonatal death was significantly higher for infants from East Java (OR = 5.01, p = 0.00), and for North, Central and Southeast Sulawesi and Gorontalo combined (OR = 3.17, p = 0.03) compared to the lowest neonatal mortality regions of Bali, South Sulawesi and Jambi provinces. A progressive reduction in the odds was found as the percentage of deliveries assisted by trained delivery attendants in the cluster increased. The odds of neonatal death were higher for infants born to both mother and father who were employed (OR = 1.84, p = 0.00) and for infants born to father who were unemployed (OR = 2.99, p = 0.02). The odds were also higher for higher rank infants with a short birth interval (OR = 2.82, p = 0.00), male infants (OR = 1.49, p = 0.01), smaller than average-sized infants (OR = 2.80, p = 0.00), and infant's whose mother had a history of delivery complications (OR = 1.81, p = 0.00). Infants receiving any postnatal care were significantly protected from neonatal death (OR = 0.63, p = 0.03). CONCLUSION Public health interventions directed at reducing neonatal death should address community, household and individual level factors which significantly influence neonatal mortality in Indonesia. Low birth weight and short birth interval infants as well as perinatal health services factors, such as the availability of skilled birth attendance and postnatal care utilization should be taken into account when planning the interventions to reduce neonatal mortality in Indonesia."", ""Neonatal Mortality Levels for 193 Countries in 2009 with Trends since 1990: A Systematic Analysis of Progress, Projections, and Priorities BACKGROUND Historically, the main focus of studies of childhood mortality has been the infant and under-five mortality rates. Neonatal mortality (deaths <28 days of age) has received limited attention, although such deaths account for about 41% of all child deaths. To better assess progress, we developed annual estimates for neonatal mortality rates (NMRs) and neonatal deaths for 193 countries for the period 1990-2009 with forecasts into the future. METHODS AND FINDINGS We compiled a database of mortality in neonates and children (<5 years) comprising 3,551 country-years of information. Reliable civil registration data from 1990 to 2009 were available for 38 countries. A statistical model was developed to estimate NMRs for the remaining 155 countries, 17 of which had no national data. Country consultation was undertaken to identify data inputs and review estimates. In 2009, an estimated 3.3 million babies died in the first month of life-compared with 4.6 million neonatal deaths in 1990-and more than half of all neonatal deaths occurred in five countries of the world (44% of global livebirths): India 27.8% (19.6% of global livebirths), Nigeria 7.2% (4.5%), Pakistan 6.9% (4.0%), China 6.4% (13.4%), and Democratic Republic of the Congo 4.6% (2.1%). Between 1990 and 2009, the global NMR declined by 28% from 33.2 deaths per 1,000 livebirths to 23.9. The proportion of child deaths that are in the neonatal period increased in all regions of the world, and globally is now 41%. While NMRs were halved in some regions of the world, Africa's NMR only dropped 17.6% (43.6 to 35.9). CONCLUSIONS Neonatal mortality has declined in all world regions. Progress has been slowest in the regions with high NMRs. Global health programs need to address neonatal deaths more effectively if Millennium Development Goal 4 (two-thirds reduction in child mortality) is to be achieved."", ""A meta-analysis of depression during pregnancy and the risk of preterm birth, low birth weight, and intrauterine growth restriction. CONTEXT Maternal depressive symptoms during pregnancy have been reported in some, but not all, studies to be associated with an increased risk of preterm birth (PTB), low birth weight (LBW), and intrauterine growth restriction (IUGR). OBJECTIVE To estimate the risk of PTB, LBW, and IUGR associated with antenatal depression. DATA SOURCES AND STUDY SELECTION We searched for English-language and non-English-language articles via the MEDLINE, PsycINFO, CINAHL, Social Work Abstracts, Social Services Abstracts, and Dissertation Abstracts International databases (January 1980 through December 2009). We aimed to include prospective studies reporting data on antenatal depression and at least 1 adverse birth outcome: PTB (<37 weeks' gestation), LBW (<2500 g), or IUGR (<10th percentile for gestational age). Of 862 reviewed studies, 29 US-published and non-US-published studies met the selection criteria. DATA EXTRACTION Information was extracted on study characteristics, antenatal depression measurement, and other biopsychosocial risk factors and was reviewed twice to minimize error. DATA SYNTHESIS Pooled relative risks (RRs) for the effect of antenatal depression on each birth outcome were calculated using random-effects methods. In studies of PTB, LBW, and IUGR that used a categorical depression measure, pooled effect sizes were significantly larger (pooled RR [95% confidence interval] = 1.39 [1.19-1.61], 1.49 [1.25-1.77], and 1.45 [1.05-2.02], respectively) compared with studies that used a continuous depression measure (1.03 [1.00-1.06], 1.04 [0.99-1.09], and 1.02 [1.00-1.04], respectively). The estimates of risk for categorically defined antenatal depression and PTB and LBW remained significant when the trim-and-fill procedure was used to correct for publication bias. The risk of LBW associated with antenatal depression was significantly larger in developing countries (RR = 2.05; 95% confidence interval, 1.43-2.93) compared with the United States (RR = 1.10; 95% confidence interval, 1.01-1.21) or European social democracies (RR = 1.16; 95% confidence interval, 0.92-1.47). Categorically defined antenatal depression tended to be associated with an increased risk of PTB among women of lower socioeconomic status in the United States. CONCLUSIONS Women with depression during pregnancy are at increased risk for PTB and LBW, although the magnitude of the effect varies as a function of depression measurement, country location, and US socioeconomic status. An important implication of these findings is that antenatal depression should be identified through universal screening and treated."", 'Perinatal mortality in rural China: retrospective cohort study. OBJECTIVES To explore the use of local civil registration data to assess the perinatal mortality in a typical rural county in a less developed province in China, 1999-2000. DESIGN Retrospective cohort study. Pregnancies in a cohort of women followed from registration of pregnancy to outcome of infant seven days after birth. SETTING Routine family planning records in 20 rural townships in eastern China. SUBJECTS 3697 pregnancies registered by the local family planning system during 1999. MAIN OUTCOME MEASURES Abortions, stillbirths, early neonatal mortality, perinatal mortality. RESULTS Only three cases were lost to follow up. The average age of the women at pregnancy was 25.9 years. Three hundred and twelve pregnancies were aborted and 240 ended in miscarriage (total 552, 15%). The perinatal mortality rate was 69 per 1000 births, the rate of stillbirth was 24 per 1000 births, and the early neonatal mortality was 46 per 1000 live births. The early neonatal mortality was 29 in boys and 69 in girls per 1000 live births. The perinatal mortality rate increased notably with parity and was higher in townships having lower income per capita. CONCLUSIONS The family planning system at the most local level is a useful data source for studying perinatal mortality in rural China. The perinatal mortality rate in the study county was higher than previously reported for both rural and urban areas in China. The results by parity and sex of the infant raise concern over the impact of the one child policy.', ""Lipid-based nutrient supplement increases the birth size of infants of primiparous women in Ghana. BACKGROUND The International Lipid-Based Nutrient Supplements Project developed a small-quantity (20 g/d) lipid-based nutrient supplement (LNS) for pregnant and lactating women. OBJECTIVE We evaluated the effects of prenatal LNS supplementation on fetal growth. DESIGN In a community-based, partially double-blind, individually randomized controlled trial, 1320 women ≤20 wk pregnant received 60 mg Fe/400 μg folic acid (IFA), or 1-2 Recommended Dietary Allowances of 18 micronutrients, including 20 mg Fe (MMN), or LNS with the same micronutrients as the MMN group, plus 4 minerals and macronutrients contributing 118 kcal (LNS) daily until delivery. Fetal growth was compared across groups by using intention-to-treat analysis. The primary outcome was birth length. RESULTS This analysis included 1057 women (IFA = 349, MMN = 354, LNS = 354). Groups did not differ significantly in mean birth length, length-for-age z score (LAZ), head circumference, or percentage low birth length but differed in mean birth weight (P = 0.044), weight-for-age z score (WAZ; P = 0.046), and BMI-for-age z score (BMIZ; P = 0.040), with a trend toward differences in low birth weight (P = 0.069). In pairwise comparisons, the LNS group had greater mean birth weight (+85 g; P = 0.040), WAZ (+0.19; P = 0.045), and BMIZ (+0.21; P = 0.035) and a lower risk of low birth weight (RR: 0.61, 95% CI: 0.39, 0.96; P = 0.032) than did the IFA group. The other group differences were not significant. The effect of intervention was modified by mother's parity, age, height, baseline hemoglobin, household food insecurity, and child sex, with parity being the most consistent modifier. Among primiparous women (IFA = 131; MMN = 110; LNS = 128), the LNS group had greater mean birth length (+0.91 cm; P = 0.001), LAZ (+0.47; P = 0.001), weight (+237 g; P < 0.001), WAZ (+0.56; P < 0.001), BMIZ (+0.52; P < 0.001), head circumference (0.50 cm; P = 0.017), and head circumference-for-age z score (+0.40; P = 0.022) than did the IFA group; similar differences were found when comparing the LNS and MMN groups among primiparous women, and no group differences were found among multiparous women. CONCLUSION Prenatal LNS supplementation can improve fetal growth among vulnerable women in Ghana, particularly primiparous women. This trial was registered at clinicaltrials.gov as NCT00970866.""]","Estimates of global prevalence of childhood underweight in 1990 and 2015.: CONTEXT One key target of the United Nations Millennium Development goals is to reduce the prevalence of underweight among children younger than 5 years by half between 1990 and 2015. OBJECTIVE To estimate trends in childhood underweight by geographic regions of the world. DESIGN, SETTING, AND PARTICIPANTS Time series study of prevalence of underweight, defined as weight 2 SDs below the mean weight for age of the National Center for Health Statistics and World Health Organization (WHO) reference population. National prevalence rates derived from the WHO Global Database on Child Growth and Malnutrition, which includes data on approximately 31 million children younger than 5 years who participated in 419 national nutritional surveys in 139 countries from 1965 through 2002. MAIN OUTCOME MEASURES Linear mixed-effects modeling was used to estimate prevalence rates and numbers of underweight children by region in 1990 and 2015 and to calculate the changes (ie, increase or decrease) to these values between 1990 and 2015. RESULTS Worldwide, underweight prevalence was projected to decline from 26.5% in 1990 to 17.6% in 2015, a change of -34% (95% confidence interval [CI], -43% to -23%). In developed countries, the prevalence was estimated to decrease from 1.6% to 0.9%, a change of -41% (95% CI, -92% to 343%). In developing regions, the prevalence was forecasted to decline from 30.2% to 19.3%, a change of -36% (95% CI, -45% to -26%). In Africa, the prevalence of underweight was forecasted to increase from 24.0% to 26.8%, a change of 12% (95% CI, 8%-16%). In Asia, the prevalence was estimated to decrease from 35.1% to 18.5%, a change of -47% (95% CI, -58% to -34%). Worldwide, the number of underweight children was projected to decline from 163.8 million in 1990 to 113.4 million in 2015, a change of -31% (95% CI, -40% to -20%). Numbers are projected to decrease in all subregions except the subregions of sub-Saharan, Eastern, Middle, and Western Africa, which are expected to experience substantial increases in the number of underweight children. CONCLUSIONS An overall improvement in the global situation is anticipated; however, neither the world as a whole, nor the developing regions, are expected to achieve the Millennium Development goals. This is largely due to the deteriorating situation in Africa where all subregions, except Northern Africa, are expected to fail to meet the goal.","The provided contexts do not contain specific information about the percentage of perinatal mortality due to low birth weight. Therefore, the evidence is insufficient to confirm or deny the statement that 5% of perinatal mortality is due to low birth weight."
36,A deficiency of vitamin B12 increases blood levels of homocysteine.,"['British Journal of Nutrition (2003), 89, 295–301 q The Authors 2003 DOI: 10.1079/BJN2002776 Plasma homocysteine concentration is decreased by dietary intervention* High plasma total homocysteine (tHcy) concentration is reported to be a risk factor for vascular diseases. We investigated the extent to which serum folate and plasma tHcy respond to a high intake of natural folate from food. Thirty-seven healthy females volunteered t o participate in a crossover dietary intervention. The study included a baseline period and two 5-week diet periods (low- and high-folate diets) with a 3-week washout in between. The low-folate diet contained one serving of both vegetables and fruit/d, while during the high-folate diet the subjects ate at least seven servings of vegetables, berries, and citrus fruit/d. Serum and erythrocyte (RBC) folate, serum vitamin B (12), and plasma tHcy concentrations were measured at the base-line and at the end of each diet period. The mean concentrations of serum and RBC folate were 11.0 (SD 3.0) nmol/l and 412 (SD 120) nmol/l at the end of the low-folate diet and 78 (95 % CI 62, 94) % and 14 (95 % CI 8, 20) % higher in response to the high-folate diet (P< 0.001). The serum concentration of vitamin B12 remained unchanged during the intervention. The mean plasma tHcy concentration was 8.0 pmol/ at the end of the low-folate diet and decreased by 13 (95% CI 9, 18) % in response to the high-folate diet (P<0.001). In conclusion, a diet high in fresh berries, citrus fruit, and vegetables effectively increases serum and RBC folate and decreases plasma homocysteine.', 'Effect of homocysteine lowering on mortality and vascular disease in advanced chronic kidney disease and end-stage renal disease: a randomized controlled trial. CONTEXT High plasma homocysteine levels are a risk factor for mortality and vascular disease in observational studies of patients with chronic kidney disease. Folic acid and B vitamins decrease homocysteine levels in this population but whether they lower mortality is unknown. OBJECTIVE To determine whether high doses of folic acid and B vitamins administered daily reduce mortality in patients with chronic kidney disease. DESIGN, SETTING, AND PARTICIPANTS Double-blind randomized controlled trial (2001-2006) in 36 US Department of Veterans Affairs medical centers. Median follow-up was 3.2 years for 2056 participants aged 21 years or older with advanced chronic kidney disease (estimated creatinine clearance < or =30 mL/min) (n = 1305) or end-stage renal disease (n = 751) and high homocysteine levels (> or = 15 micromol/L). INTERVENTION Participants received a daily capsule containing 40 mg of folic acid, 100 mg of pyridoxine hydrochloride (vitamin B6), and 2 mg of cyanocobalamin (vitamin B12) or a placebo. MAIN OUTCOME MEASURES The primary outcome was all-cause mortality. Secondary outcomes included myocardial infarction (MI), stroke, amputation of all or part of a lower extremity, a composite of these 3 plus all-cause mortality, time to initiation of dialysis, and time to thrombosis of arteriovenous access in hemodialysis patients. RESULTS Mean baseline homocysteine level was 24.0 micromol/L in the vitamin group and 24.2 micromol/L in the placebo group. It was lowered 6.3 micromol/L (25.8%; P < .001) in the vitamin group and 0.4 micromol/L (1.7%; P = .14) in the placebo group at 3 months, but there was no significant effect on mortality (448 vitamin group deaths vs 436 placebo group deaths) (hazard ratio [HR], 1.04; 95% CI, 0.91-1.18). No significant effects were demonstrated for secondary outcomes or adverse events: there were 129 MIs in the vitamin group vs 150 for placebo (HR, 0.86; 95% CI, 0.67-1.08), 37 strokes in the vitamin group vs 41 for placebo (HR, 0.90; 95% CI, 0.58-1.40), and 60 amputations in the vitamin group vs 53 for placebo (HR, 1.14; 95% CI, 0.79-1.64). In addition, the composite of MI, stroke, and amputations plus mortality (P = .85), time to dialysis (P = .38), and time to thrombosis in hemodialysis patients (P = .97) did not differ between the vitamin and placebo groups. CONCLUSION Treatment with high doses of folic acid and B vitamins did not improve survival or reduce the incidence of vascular disease in patients with advanced chronic kidney disease or end-stage renal disease. TRIAL REGISTRATION clinicaltrials.gov Identifier: NCT00032435.', 'Homocysteine and the risk of ischemic stroke in a triethnic cohort: the NOrthern MAnhattan Study. BACKGROUND AND PURPOSE The level of total homocysteine (tHcy) that confers a risk of ischemic stroke is unsettled, and no prospective cohort studies have included sufficient elderly minority subjects. We investigated the association between mild to moderate fasting tHcy level and the incidence of ischemic stroke, myocardial infarction, and vascular death in a multiethnic prospective study. METHODS A population-based cohort was followed for vascular events (stroke, myocardial infarction, and vascular death). Baseline values of tHcy and methylmalonic acid were measured among 2939 subjects (mean age, 69+/-10; 61% women, 53% Hispanics, 24% blacks, and 20% whites). Cox proportional models were used to calculate hazard ratios (HRs) and 95% CIs in tHcy categories after adjusting for age, race, education, renal insufficiency, B12 deficiency, and other risk factors. RESULTS The adjusted HR for a tHcy level > or =15 micromol/L compared with <10 micromol/L was greatest for vascular death (HR=6.04; 95% CI, 3.44 to 10.60), followed by combined vascular events (HR=2.27; 95% CI, 1.51 to 3.43), ischemic stroke (HR=2.01; 95% CI, 1.00 to 4.05), and nonvascular death (HR=2.02; 95% CI, 1.31 to 3.14). Mild to moderate elevations of tHcy of 10 to 15 micromol/L were not significantly predictive of ischemic stroke, but increased the risk of vascular death (2.27; 95% CI, 1.44 to 3.60) and combined vascular events (1.42; 95% CI, 1.06 to 1.88). The effect of tHcy was stronger among whites and Hispanics, but not a significant risk factor for blacks. CONCLUSIONS Total Hcy elevations above 15 micromol/L are an independent risk factor for ischemic stroke, whereas mild elevations of tHcy of 10 to 15 micromol/L are less predictive. The vascular effects of tHcy are greatest among whites and Hispanics, and less among blacks.', 'Preventing coronary heart disease: B vitamins and homocysteine. The list of preventable and reversible risk factors for atherosclerotic cardiovascular disease continues to grow. Cigarette smoking, high blood pressure, physical inactivity, elevated cholesterol, underlying lipoprotein abnormalities, lipoprotein(a), diabetes, overweight, male gender, and age are well-established risk factors. During the 1990s, there have been many reports associating elevated plasma homocysteine levels with arteriosclerotic cardiovascular disease and consistent evidence that dietary and supplemental folic acid can reduce homocysteine levels.1 2 The article by Robinson and colleagues3 in this issue of Circulation presents further evidence of the importance of homocysteine and suggestive evidence that plasma folate and plasma pyrixodal-l-phosphate (vitamin B6) are protective factors. Their study is part of the European Concerted Action Project,4 which examined 750 patients younger than age 60 with diagnoses within the previous 12 months of coronary, cerebrovascular, or peripheral vascular disease and 800 healthy control subjects. The patient groups were young (47 years for cases and 44 years for control subjects) and heterogeneous, with nonfatal clinical events or symptoms of arteriosclerotic cardiovascular disease supported by ECG, angiographic, or Doppler evidence; the study involved 19 centers in nine European countries. Men in the highest quintile for fasting total homocysteine (tHcy), compared with the remainder of the population, had an estimated relative risk of 2.2 (95% confidence interval [CI], 1.6 to 2.9), with a striking dose-response relationship and a more-than-multiplicative interaction with cigarette smoking and high blood pressure on vascular disease risk4 ; the corresponding estimated relative risk for coronary heart disease was similar (2.0; 95% CI 1.6 to 2.8). (tHcy is the sum of homocysteine and homocysteinyl moieties of oxidized disulfides, homocystine, and cysteine- homocysteine. ) Robinson and colleagues3 examined three B vitamins in detail to determine their effects on fasting and post–methionine-loading tHcy levels and any independent effects on cardiovascular disease …', ""Folate and vitamin B6 from diet and supplements in relation to risk of coronary heart disease among women. CONTEXT Hyperhomocysteinemia is caused by genetic and lifestyle influences, including low intakes of folate and vitamin B6. However, prospective data relating intake of these vitamins to risk of coronary heart disease (CHD) are not available. OBJECTIVE To examine intakes of folate and vitamin B6 in relation to the incidence of nonfatal myocardial infarction (MI) and fatal CHD. DESIGN Prospective cohort study. SETTING AND PATIENTS In 1980, a total of 80082 women from the Nurses' Health Study with no previous history of cardiovascular disease, cancer, hypercholesterolemia, or diabetes completed a detailed food frequency questionnaire from which we derived usual intake of folate and vitamin B6. MAIN OUTCOME MEASURE Nonfatal MI and fatal CHD confirmed by World Health Organization criteria. RESULTS During 14 years of follow-up, we documented 658 incident cases of nonfatal MI and 281 cases of fatal CHD. After controlling for cardiovascular risk factors, including smoking and hypertension and intake of alcohol, fiber, vitamin E, and saturated, polyunsaturated, and trans fat, the relative risks (RRs) of CHD between extreme quintiles were 0.69 (95% confidence interval [CI], 0.55-0.87) for folate (median intake, 696 microg/d vs 158 microg/d) and 0.67 (95% CI, 0.53-0.85) for vitamin B6 (median intake, 4.6 mg/d vs 1.1 mg/d). Controlling for the same variables, the RR was 0.55 (95% CI, 0.41-0.74) among women in the highest quintile of both folate and vitamin B6 intake compared with the opposite extreme. Risk of CHD was reduced among women who regularly used multiple vitamins (RR=0.76; 95% CI, 0.65-0.90), the major source of folate and vitamin B6, and after excluding multiple vitamin users, among those with higher dietary intakes of folate and vitamin B6. In a subgroup analysis, compared with nondrinkers, the inverse association between a high-folate diet and CHD was strongest among women who consumed up to 1 alcoholic beverage per day (RR =0.69; 95% CI, 0.49-0.97) or more than 1 drink per day (RR=0.27; 95% CI, 0.13-0.58). CONCLUSION These results suggest that intake of folate and vitamin B6 above the current recommended dietary allowance may be important in the primary prevention of CHD among women.""]","Folic acid improves endothelial function in coronary artery disease via mechanisms largely independent of homocysteine lowering.: BACKGROUND Homocysteine is a risk factor for coronary artery disease (CAD), although a causal relation remains to be proven. The importance of determining direct causality rests in the fact that plasma homocysteine can be safely and inexpensively reduced by 25% with folic acid. This reduction is maximally achieved by doses of 0.4 mg/d. High-dose folic acid (5 mg/d) improves endothelial function in CAD, although the mechanism is controversial. It has been proposed that improvement occurs through reduction in total (tHcy) or free (non-protein bound) homocysteine (fHcy). We investigated the effects of folic acid on endothelial function before a change in homocysteine in patients with CAD. METHODS AND RESULTS A randomized, placebo-controlled study of folic acid (5 mg/d) for 6 weeks was undertaken in 33 patients. Endothelial function, assessed by flow-mediated dilatation (FMD), was measured before, at 2 and 4 hours after the first dose of folic acid, and after 6 weeks of treatment. Plasma folate increased markedly by 1 hour (200 compared with 25.8 nmol/L; P<0.001). FMD improved at 2 hours (83 compared with 47 microm; P<0.001) and was largely complete by 4 hours (101 compared with 51 microm; P<0.001). tHcy did not significantly differ acutely (4-hour tHcy, 9.56 compared with 9.79 micromol/L; P=NS). fHcy did not differ at 3 hours but was slightly reduced at 4 hours (1.55 compared with 1.78 micromol/L; P=0.02). FMD improvement did not correlate with reductions in either fHcy or tHcy at any time. CONCLUSIONS These data suggest that folic acid improves endothelial function in CAD acutely by a mechanism largely independent of homocysteine. Randomized trial of folic acid supplementation and serum homocysteine levels.: BACKGROUND Lowering serum homocysteine levels with folic acid is expected to reduce mortality from ischemic heart disease. Homocysteine reduction is known to be maximal at a folic acid dosage of 1 mg/d, but the effect of lower doses (relevant to food fortification) is unclear. METHODS We randomized 151 patients with ischemic heart disease to 1 of 5 dosages of folic acid (0.2, 0.4, 0.6, 0.8, and 1.0 mg/d) or placebo. Fasting blood samples for serum homocysteine and serum folate analysis were taken initially, after 3 months of supplementation, and 3 months after folic acid use was discontinued. RESULTS Median serum homocysteine level decreased with increasing folic acid dosage, to a maximum at 0.8 mg of folic acid per day, when the homocysteine reduction (placebo adjusted) was 2.7 micromol/L (23%), similar to the known effect of folic acid dosages of 1 mg/d and above. The higher a person's initial serum homocysteine level, the greater was the response to folic acid, but there were statistically significant reductions regardless of the initial level. Serum folate level increased approximately linearly (5.5 nmol/L for every 0.1 mg of folic acid). Within-person fluctuations over time in serum homocysteine levels, measured in the placebo group, were large compared with the effect of folic acid, indicating that monitoring of the reduction in an individual is impractical. CONCLUSIONS A dosage of folic acid of 0.8 mg/d appears necessary to achieve the maximum reduction in serum homocysteine level across the range of homocysteine levels in the population. Current US food fortification levels will achieve only a small proportion of the achievable homocysteine reduction.","The provided contexts do not directly address the relationship between vitamin B12 deficiency and homocysteine levels. While Context [2] mentions that high doses of folic acid and B vitamins (including B12) were used to lower homocysteine levels in patients with chronic kidney disease and end-stage renal disease, it does not specifically discuss the effect of vitamin B12 deficiency"
42,A high microerythrocyte count raises vulnerability to severe anemia in homozygous alpha (+)- thalassemia trait subjects.,"['Increased Microerythrocyte Count in Homozygous α+-Thalassaemia Contributes to Protection against Severe Malarial Anaemia BACKGROUND The heritable haemoglobinopathy alpha(+)-thalassaemia is caused by the reduced synthesis of alpha-globin chains that form part of normal adult haemoglobin (Hb). Individuals homozygous for alpha(+)-thalassaemia have microcytosis and an increased erythrocyte count. Alpha(+)-thalassaemia homozygosity confers considerable protection against severe malaria, including severe malarial anaemia (SMA) (Hb concentration < 50 g/l), but does not influence parasite count. We tested the hypothesis that the erythrocyte indices associated with alpha(+)-thalassaemia homozygosity provide a haematological benefit during acute malaria. METHODS AND FINDINGS Data from children living on the north coast of Papua New Guinea who had participated in a case-control study of the protection afforded by alpha(+)-thalassaemia against severe malaria were reanalysed to assess the genotype-specific reduction in erythrocyte count and Hb levels associated with acute malarial disease. We observed a reduction in median erythrocyte count of approximately 1.5 x 10(12)/l in all children with acute falciparum malaria relative to values in community children (p < 0.001). We developed a simple mathematical model of the linear relationship between Hb concentration and erythrocyte count. This model predicted that children homozygous for alpha(+)-thalassaemia lose less Hb than children of normal genotype for a reduction in erythrocyte count of >1.1 x 10(12)/l as a result of the reduced mean cell Hb in homozygous alpha(+)-thalassaemia. In addition, children homozygous for alpha(+)-thalassaemia require a 10% greater reduction in erythrocyte count than children of normal genotype (p = 0.02) for Hb concentration to fall to 50 g/l, the cutoff for SMA. We estimated that the haematological profile in children homozygous for alpha(+)-thalassaemia reduces the risk of SMA during acute malaria compared to children of normal genotype (relative risk 0.52; 95% confidence interval [CI] 0.24-1.12, p = 0.09). CONCLUSIONS The increased erythrocyte count and microcytosis in children homozygous for alpha(+)-thalassaemia may contribute substantially to their protection against SMA. A lower concentration of Hb per erythrocyte and a larger population of erythrocytes may be a biologically advantageous strategy against the significant reduction in erythrocyte count that occurs during acute infection with the malaria parasite Plasmodium falciparum. This haematological profile may reduce the risk of anaemia by other Plasmodium species, as well as other causes of anaemia. Other host polymorphisms that induce an increased erythrocyte count and microcytosis may confer a similar advantage.', 'Microcytosis, iron deficiency and thalassaemia in a multi-ethnic community: a pilot study. The high prevalence of microcytosis (defined here as mean cell haemoglobin<27 pg) with no other abnormality is a principal cause of confusion in screening for haemoglobin disorders. Here we report the results of a small pilot study aiming to resolve this confusion by routinely proceeding to plasma ferritin and HPLC assay, using the original sequestrene blood sample, when microcytosis is detected. Participants comprised a random sample of 1,302 people referred for a full blood count by their General Practitioner (GP) to the laboratory of a North London district general hospital serving a multi-ethnic inner-city population. Ethnicity was established by questionnaire. In North Europeans, microcytosis was present in 3% of males (half were iron-deficient) and 11% of females (most were iron-deficient). Among ethnic minorities, microcytosis was present in 35% of males (one tenth were iron-deficient), and 45% of females (less than half were iron-deficient): an exclusion diagnosis of ""probable alpha thalassaemia"" could be made in the remainder. We conclude that when microcytosis is present, routine further analysis of the original sequestrene sample by plasma ferritin assay and haemoglobinopathy screening could lead to a more efficient and cost-effective laboratory service for primary care and maternity services.', 'Abnormalities in the myeloid progenitor compartment in Down syndrome fetal liver precede acquisition of GATA1 mutations. Down syndrome (DS) children have a high frequency of acute megakaryoblastic leukemia (AMKL) in early childhood. At least 2 in utero genetic events are required, although not sufficient, for DS-AMKL: trisomy 21 (T21) and N-terminal-truncating GATA1 mutations. To investigate the role of T21 in DS-AMKL, we compared second trimester hemopoiesis in DS without GATA1 mutations to gestation-matched normal controls. In all DS fetal livers (FLs), but not marrows, megakaryocyte-erythroid progenitor frequency was increased (55.9% +/- 4% vs 17.1% +/- 3%, CD34(+)CD38(+) cells; P < .001) with common myeloid progenitors (19.6% +/- 2% vs 44.0% +/- 7%) and granulocyte-monocyte (GM) progenitors (15.8% +/- 4% vs 34.5% +/- 9%) commensurately reduced. Clonogenicity of DS-FL versus normal FL CD34(+) cells was markedly increased (78% +/- 7% vs 15% +/- 3%) affecting megakaryocyte-erythroid ( approximately 7-fold higher) and GM and colony-forming unit-granulocyte, erythrocyte macrophage, megakaryocyte (CFU-GEMM) progenitors. Replating efficiency of CFU-GEMM was also markedly increased. These data indicate that T21 itself profoundly disturbs FL hemopoiesis and they provide a testable hypothesis to explain the increased susceptibility to GATA1 mutations in DS-AMKL and DS-associated transient myeloproliferative disorder.', 'Thalassemia and malaria: new insights into an old problem. The hemoglobinopathies are probably the world\'s most common genetic diseases: The World Health Organization has estimated that at least 5% of the population are carriers for one or other of the most serious forms, the alpha- and beta-thalassemias and the structural variant hemoglobins S, C, and E, which are found at polymorphic frequencies in many countries. All these hemoglobinopathies are believed to provide protection against malaria, and it is thought that, in malarial regions of the world, natural selection has been responsible for elevating and maintaining their gene frequencies, an idea first proposed 50 years ago by J.B.S. Haldane. Epidemiological studies undertaken in the 1950s on hemoglobin S in Africa provided support for the ""malaria hypothesis,"" but until recently it has proved extremely difficult to verify it for the thalassemias. The application of molecular methods has, however, provided new opportunities to address this old question. Population and molecular genetic analysis of thalassemia variants, and microepidemiological studies of the relationship between alpha-thalassemia and malaria in the southwest Pacific, have provided unequivocal evidence for protection. Surprisingly, some of this protection appears to derive from enhanced susceptibility in very young thalassemic children to both Plasmodium falciparum and, especially, P. vivax, and this early exposure appears to provide the basis for better protection in later life.', 'A paediatric case of sideroblastic anaemia. Ultrastructural studies of erythroblasts cultured from marrow BFU-E in a methylcellulose micromethod. We examined the morphological and functional characteristics of erythroblasts derived from marrow erythroid progenitor cells grown in a methylcellulose microculture, which were taken from a female child with rare atypical sideroblastic anaemia (SA) partially responsive to pyridoxine. Colony formation was within the normal range in three successive cultures (median values: 82.25 CFU-E and 16.4 BFU-E derived colonies/6.6 X 10(4) cells) compared to growth by normal cells (65-315 CFU-E and 9-40 BFU-E). We evaluated in vitro differentiation by biochemical microassay of a cytosol enzyme involved in the haem pathway: uroporphyrinogen I synthase (UROS). The UROS values in the erythroid colonies from SA marrow were at the lowere end of the normal range (median values: 6.7 +/- 0.3 and 14.4 +/- 3.8 pmol uroporphyrinogen/h in CFU-E and BFU-E-derived colonies respectively versus 17.4 +/- 7.3 and 25 +/- 7.2 pmol/h in CFU-E and BFU-E colonies from normal subjects. Ultrastructural examination of the SA erythroblasts from non-cultured bone marrow or derived from cultured BFU-E revealed the characteristic deposition of iron in mitochondria around the nucleus of most cells (ringed sideroblasts). However, the majority of cultured cells had marked dyserythropoietic features, with a large number of bilobulated or trilobulated erythroblasts, multiple cytoplasmic vacuoles, numerous abnormalities of the nucleus, and excessive membrane material beneath the plasma membrane, all features difficult to observe in non-cultured marrows.']","Increased Microerythrocyte Count in Homozygous α+-Thalassaemia Contributes to Protection against Severe Malarial Anaemia: BACKGROUND The heritable haemoglobinopathy alpha(+)-thalassaemia is caused by the reduced synthesis of alpha-globin chains that form part of normal adult haemoglobin (Hb). Individuals homozygous for alpha(+)-thalassaemia have microcytosis and an increased erythrocyte count. Alpha(+)-thalassaemia homozygosity confers considerable protection against severe malaria, including severe malarial anaemia (SMA) (Hb concentration < 50 g/l), but does not influence parasite count. We tested the hypothesis that the erythrocyte indices associated with alpha(+)-thalassaemia homozygosity provide a haematological benefit during acute malaria. METHODS AND FINDINGS Data from children living on the north coast of Papua New Guinea who had participated in a case-control study of the protection afforded by alpha(+)-thalassaemia against severe malaria were reanalysed to assess the genotype-specific reduction in erythrocyte count and Hb levels associated with acute malarial disease. We observed a reduction in median erythrocyte count of approximately 1.5 x 10(12)/l in all children with acute falciparum malaria relative to values in community children (p < 0.001). We developed a simple mathematical model of the linear relationship between Hb concentration and erythrocyte count. This model predicted that children homozygous for alpha(+)-thalassaemia lose less Hb than children of normal genotype for a reduction in erythrocyte count of >1.1 x 10(12)/l as a result of the reduced mean cell Hb in homozygous alpha(+)-thalassaemia. In addition, children homozygous for alpha(+)-thalassaemia require a 10% greater reduction in erythrocyte count than children of normal genotype (p = 0.02) for Hb concentration to fall to 50 g/l, the cutoff for SMA. We estimated that the haematological profile in children homozygous for alpha(+)-thalassaemia reduces the risk of SMA during acute malaria compared to children of normal genotype (relative risk 0.52; 95% confidence interval [CI] 0.24-1.12, p = 0.09). CONCLUSIONS The increased erythrocyte count and microcytosis in children homozygous for alpha(+)-thalassaemia may contribute substantially to their protection against SMA. A lower concentration of Hb per erythrocyte and a larger population of erythrocytes may be a biologically advantageous strategy against the significant reduction in erythrocyte count that occurs during acute infection with the malaria parasite Plasmodium falciparum. This haematological profile may reduce the risk of anaemia by other Plasmodium species, as well as other causes of anaemia. Other host polymorphisms that induce an increased erythrocyte count and microcytosis may confer a similar advantage.","The evidence provided in the contexts does not support the statement that a high microerythrocyte count raises vulnerability to severe anemia in subjects with the homozygous alpha (+)-thalassemia trait. In fact, Context [1] suggests the opposite: the increased erythrocyte count and microcytosis in children homozygous for alpha (+)-thalassaemia may"
48,"A total of 1,000 people in the UK are asymptomatic carriers of vCJD infection.","['Sporadic Creutzfeldt-Jakob disease in the United Kingdom: analysis of epidemiological surveillance data for 1970-96. OBJECTIVE To identify changes in the occurrence of Creutzfeldt-Jakob disease that might be related to the epidemic of bovine spongiform encephalopathy. DESIGN Epidemiological surveillance of the United Kingdom population for Creutzfeldt-Jakob disease based on (a) referral of suspected cases by neurologists, neuropathologists, and neurophysiologists and (b) death certificates. SETTING England and Wales during 1970-84, and whole of the United Kingdom during 1985-96. SUBJECTS All 662 patients identified as sporadic cases of Creutzfeldt-Jakob disease. MAIN OUTCOME MEASURES Age distribution of patients, age specific time trends of disease, occupational exposure to cattle, potential exposure to causative agent of bovine spongiform encephalopathy. RESULTS During 1970-96 there was an increase in the number of sporadic cases of Creutzfeldt-Jakob disease recorded yearly in England and Wales. The greatest increase was among people aged over 70. There was a statistically significant excess of cases among dairy farm workers and their spouses and among people at increased risk of contact with live cattle infected with bovine spongiform encephalopathy. During 1994-6 there were six deaths from sporadic Creutzfeldt-Jakob disease in the United Kingdom in patients aged under 30. CONCLUSIONS The increase in the incidence of sporadic Creutzfeldt-Jakob disease and the high incidence in dairy farmers in the United Kingdom may be unrelated to bovine spongiform encephalopathy. The most striking change in the pattern of Creutzfeldt-Jakob disease in the United Kingdom after the epidemic of bovine spongiform encephalopathy is provided by the incidence in a group of exceptionally young patients with a consistent and unusual neuropathological profile. The outcome of mouse transmission studies and the future incidence of the disease in the United Kingdom and elsewhere, will be important in judging whether the agent causing bovine spongiform encephalopathy has infected humans.', 'Prevalent abnormal prion protein in human appendixes after bovine spongiform encephalopathy epizootic: large scale survey OBJECTIVES To carry out a further survey of archived appendix samples to understand better the differences between existing estimates of the prevalence of subclinical infection with prions after the bovine spongiform encephalopathy epizootic and to see whether a broader birth cohort was affected, and to understand better the implications for the management of blood and blood products and for the handling of surgical instruments. DESIGN Irreversibly unlinked and anonymised large scale survey of archived appendix samples. SETTING Archived appendix samples from the pathology departments of 41 UK hospitals participating in the earlier survey, and additional hospitals in regions with lower levels of participation in that survey. SAMPLE 32,441 archived appendix samples fixed in formalin and embedded in paraffin and tested for the presence of abnormal prion protein (PrP). RESULTS Of the 32,441 appendix samples 16 were positive for abnormal PrP, indicating an overall prevalence of 493 per million population (95% confidence interval 282 to 801 per million). The prevalence in those born in 1941-60 (733 per million, 269 to 1596 per million) did not differ significantly from those born between 1961 and 1985 (412 per million, 198 to 758 per million) and was similar in both sexes and across the three broad geographical areas sampled. Genetic testing of the positive specimens for the genotype at PRNP codon 129 revealed a high proportion that were valine homozygous compared with the frequency in the normal population, and in stark contrast with confirmed clinical cases of vCJD, all of which were methionine homozygous at PRNP codon 129. CONCLUSIONS This study corroborates previous studies and suggests a high prevalence of infection with abnormal PrP, indicating vCJD carrier status in the population compared with the 177 vCJD cases to date. These findings have important implications for the management of blood and blood products and for the handling of surgical instruments.', ""Lack of evidence of transfusion transmission of Creutzfeldt-Jakob disease in a US surveillance study. BACKGROUND Since 2004, several reported transfusion transmissions of variant Creutzfeldt-Jakob disease (vCJD) in the United Kingdom have reawakened concerns about the possible risk of similar transmissions of nonvariant or classic forms of CJD. STUDY DESIGN AND METHODS Patients with a CJD diagnosis and a history of donating blood were reported to the study coordinator. Through review of blood distribution and hospital records, the recipients of blood components from these donors were identified. We then determined each recipient's vital status and, if deceased, the cause(s) of death identified by matching the recipient's personal identifiers with the Centers for Disease Control and Prevention's National Death Index database. We conducted such searches after recipients were enrolled in this study and annually thereafter for those who remained alive. RESULTS The study included a total of 36 blood donors who subsequently developed CJD and 436 recipients. Through 2006, 91 of these recipients were still alive, 329 were deceased, and 16 were lost to follow-up. After transfusion, these three groups had survived a total of 2096.0 person-years. A total of 144 recipients survived 5 years or longer after transfusion and 68 of them had received blood donated 60 or fewer months before the onset of CJD in the donor. We identified no recipient with CJD. CONCLUSIONS The current results of this large, ongoing lookback study show no evidence of transfusion transmission of CJD. They reinforce the conclusion that the risk, if any, of transfusion transmission of prion disease by CJD donors is significantly lower than the comparable risk of such transmission by vCJD donors."", 'Transmission of sporadic Creutzfeldt-Jakob disease by blood transfusion: risk factor or possible biases. BACKGROUND The occurrence of transfusion transmissions of variant Creutzfeldt-Jakob disease (CJD) cases has reawakened attention to the possible similar risk posed by other forms of CJD. STUDY DESIGN AND METHODS CJD with a definite or probable diagnosis (sporadic CJD, n = 741; genetic CJD, n = 175) and no-CJD patients with definite alternative diagnosis (n = 482) with available blood transfusion history were included in the study. The risk of exposure to blood transfusion occurring more than 10 years before disease onset and for some possible confounding factors was evaluated by calculating crude odds ratios (ORs). Variables with significant ORs in univariate analyses were included in multivariate logistic regression analyses. RESULTS In the univariate model, blood transfusion occurring more than 10 years before clinical onset is 4.1-fold more frequent in sporadic CJD than in other neurologic disorders. This significance is lost when the 10-year lag time was not considered. Multivariate analyses show that the risk of developing sporadic CJD after transfusion increases (OR, 5.05) after adjusting for possible confounding factors. Analysis conducted on patients with genetic CJD did not reveal any significant risk factor associated with transfusion. CONCLUSION This is the first case-control study showing a significant risk of transfusion occurring more than 10 years before clinical onset in sporadic CJD patients. It remains questionable whether the significance of these data is biologically plausible or the consequence of biases in the design of the study, but they counterbalance previous epidemiologic negative reports that might have overestimated the assessment of blood safety in sporadic CJD.', 'Research Letters We report a case of preclinical variant Creutzfeldt-Jakob disease (vCJD) in a patient who died from a non-neurological disorder 5 years after receiving a blood transfusion from a donor who subsequently developed vCJD. Protease-resistant prion protein (PrP(res)) was detected by western blot, paraffin-embedded tissue blot, and immunohistochemistry in the spleen, but not in the brain. Immunohistochemistry for prion protein was also positive in a cervical lymph node. The patient was a heterozygote at codon 129 of PRNP, suggesting that susceptibility to vCJD infection is not confined to the methionine homozygous PRNP genotype. These findings have major implications for future estimates and surveillance of vCJD in the UK.']","Prevalent abnormal prion protein in human appendixes after bovine spongiform encephalopathy epizootic: large scale survey: OBJECTIVES To carry out a further survey of archived appendix samples to understand better the differences between existing estimates of the prevalence of subclinical infection with prions after the bovine spongiform encephalopathy epizootic and to see whether a broader birth cohort was affected, and to understand better the implications for the management of blood and blood products and for the handling of surgical instruments. DESIGN Irreversibly unlinked and anonymised large scale survey of archived appendix samples. SETTING Archived appendix samples from the pathology departments of 41 UK hospitals participating in the earlier survey, and additional hospitals in regions with lower levels of participation in that survey. SAMPLE 32,441 archived appendix samples fixed in formalin and embedded in paraffin and tested for the presence of abnormal prion protein (PrP). RESULTS Of the 32,441 appendix samples 16 were positive for abnormal PrP, indicating an overall prevalence of 493 per million population (95% confidence interval 282 to 801 per million). The prevalence in those born in 1941-60 (733 per million, 269 to 1596 per million) did not differ significantly from those born between 1961 and 1985 (412 per million, 198 to 758 per million) and was similar in both sexes and across the three broad geographical areas sampled. Genetic testing of the positive specimens for the genotype at PRNP codon 129 revealed a high proportion that were valine homozygous compared with the frequency in the normal population, and in stark contrast with confirmed clinical cases of vCJD, all of which were methionine homozygous at PRNP codon 129. CONCLUSIONS This study corroborates previous studies and suggests a high prevalence of infection with abnormal PrP, indicating vCJD carrier status in the population compared with the 177 vCJD cases to date. These findings have important implications for the management of blood and blood products and for the handling of surgical instruments.","The provided contexts do not specify an exact number of asymptomatic carriers of vCJD infection in the UK, but they do provide prevalence estimates. Context [2] indicates an overall prevalence of 493 per million population for the presence of abnormal PrP, which suggests vCJD carrier status. To determine the number of asymptomatic carriers, we can use this prevalence rate.

Given a prevalence"
49,ADAR1 binds to Dicer to cleave pre-miRNA.,"['ADAR1 Forms a Complex with Dicer to Promote MicroRNA Processing and RNA-Induced Gene Silencing Adenosine deaminases acting on RNA (ADARs) are involved in RNA editing that converts adenosine residues to inosine specifically in double-stranded RNAs. In this study, we investigated the interaction of the RNA editing mechanism with the RNA interference (RNAi) machinery and found that ADAR1 forms a complex with Dicer through direct protein-protein interaction. Most importantly, ADAR1 increases the maximum rate (Vmax) of pre-microRNA (miRNA) cleavage by Dicer and facilitates loading of miRNA onto RNA-induced silencing complexes, identifying a new role of ADAR1 in miRNA processing and RNAi mechanisms. ADAR1 differentiates its functions in RNA editing and RNAi by the formation of either ADAR1/ADAR1 homodimer or Dicer/ADAR1 heterodimer complexes, respectively. As expected, the expression of miRNAs is globally inhibited in ADAR1(-/-) mouse embryos, which, in turn, alters the expression of their target genes and might contribute to their embryonic lethal phenotype.', 'Phosphate and R2D2 restrict the substrate specificity of Dicer-2, an ATP-driven ribonuclease. Drosophila Dicer-2 generates small interfering RNAs (siRNAs) from long double-stranded RNA (dsRNA), whereas Dicer-1 produces microRNAs (miRNAs) from pre-miRNA. What makes the two Dicers specific for their biological substrates? We find that purified Dicer-2 can efficiently cleave pre-miRNA, but that inorganic phosphate and the Dicer-2 partner protein R2D2 inhibit pre-miRNA cleavage. Dicer-2 contains C-terminal RNase III domains that mediate RNA cleavage and an N-terminal helicase motif, whose function is unclear. We show that Dicer-2 is a dsRNA-stimulated ATPase that hydrolyzes ATP to ADP; ATP hydrolysis is required for Dicer-2 to process long dsRNA, but not pre-miRNA. Wild-type Dicer-2, but not a mutant defective in ATP hydrolysis, can generate siRNAs faster than it can dissociate from a long dsRNA substrate. We propose that the Dicer-2 helicase domain uses ATP to generate many siRNAs from a single molecule of dsRNA before dissociating from its substrate.', 'Molecular mechanisms that funnel RNA precursors into endogenous small-interfering RNA and microRNA biogenesis pathways in Drosophila. In Drosophila, three types of endogenous small RNAs-microRNAs (miRNAs), PIWI-interacting RNAs (piRNAs), and endogenous small-interfering RNAs (endo-siRNAs or esiRNAs)-function as triggers in RNA silencing. Although piRNAs are produced independently of Dicer, miRNA and esiRNA biogenesis pathways require Dicer1 and Dicer2, respectively. Recent studies have shown that among the four isoforms of Loquacious (Loqs), Loqs-PB and Loqs-PD are involved in miRNA and esiRNA processing pathways, respectively. However, how these Loqs isoforms function in their respective small RNA biogenesis pathways remains elusive. Here, we show that Loqs-PD associates specifically with Dicer2 through its C-terminal domain. The Dicer2-Loqs-PD complex contains R2D2, another known Dicer2 partner, and excises both exogenous siRNAs and esiRNAs from their corresponding precursors in vitro. However, Loqs-PD, but not R2D2, enhanced Dicer2 activity. The Dicer2-Loqs-PD complex processes esiRNA precursor hairpins with long stems, which results in the production of AGO2-associated small RNAs. Interestingly, however, small RNAs derived from terminal hairpins of esiRNA precursors are loaded onto AGO1; thus, they are classified as a new subset of miRNAs. These results suggest that the precursor RNA structure determines the biogenesis mechanism of esiRNAs and miRNAs, thereby implicating hairpin structures with long stems as intermediates in the evolution of Drosophila miRNA.', ""miRNA-dependent gene silencing involving Ago2-mediated cleavage of a circular antisense RNA. MicroRNAs (miRNAs) are ∼22 nt non-coding RNAs that typically bind to the 3' UTR of target mRNAs in the cytoplasm, resulting in mRNA destabilization and translational repression. Here, we report that miRNAs can also regulate gene expression by targeting non-coding antisense transcripts in human cells. Specifically, we show that miR-671 directs cleavage of a circular antisense transcript of the Cerebellar Degeneration-Related protein 1 (CDR1) locus in an Ago2-slicer-dependent manner. The resulting downregulation of circular antisense has a concomitant decrease in CDR1 mRNA levels, independently of heterochromatin formation. This study provides the first evidence for non-coding antisense transcripts as functional miRNA targets, and a novel regulatory mechanism involving a positive correlation between mRNA and antisense circular RNA levels."", 'Requirement for the ERI/DICER complex in endogenous RNA interference and sperm development in Caenorhabditis elegans. Small regulatory RNAs are key regulators of gene expression. One class of small regulatory RNAs, termed the endogenous small interfering RNAs (endo siRNAs), is thought to negatively regulate cellular transcripts via an RNA interference (RNAi)-like mechanism termed endogenous RNAi (endo RNAi). A complex of proteins composed of ERI-1/3/5, RRF-3, and DICER (the ERI/DICER complex) mediates endo RNAi processes in Caenorhabditis elegans. We conducted a genetic screen to identify additional components of the endo RNAi machinery. Our screen recovered alleles of eri-9, which encodes a novel DICER-interacting protein, and a missense mutation within the helicase domain of DICER [DCR-1(G492R)]. ERI-9(-) and DCR-1(G492) animals exhibit defects in endo siRNA expression and a concomitant failure to regulate mRNAs that exhibit sequence homology to these endo siRNAs, indicating that ERI-9 and the DCR-1 helicase domain function in the C. elegans endo RNAi pathway. We define a subset of Eri mutant animals (including eri-1, rrf-3, eri-3, and dcr-1, but not eri-9 or ergo-1) that exhibit temperature-sensitive, sperm-specific sterility and defects in X chromosome segregation. Among these mutants we find multiple aberrations in sperm development beginning with cytokinesis and extending through terminal differentiation. These results identify novel components of the endo RNAi machinery, demonstrate differential requirements for the Eri factors in the sperm-producing germline, and begin to delineate the functional requirement for the ERI/DICER complex in sperm development.']","ADAR1 Forms a Complex with Dicer to Promote MicroRNA Processing and RNA-Induced Gene Silencing: Adenosine deaminases acting on RNA (ADARs) are involved in RNA editing that converts adenosine residues to inosine specifically in double-stranded RNAs. In this study, we investigated the interaction of the RNA editing mechanism with the RNA interference (RNAi) machinery and found that ADAR1 forms a complex with Dicer through direct protein-protein interaction. Most importantly, ADAR1 increases the maximum rate (Vmax) of pre-microRNA (miRNA) cleavage by Dicer and facilitates loading of miRNA onto RNA-induced silencing complexes, identifying a new role of ADAR1 in miRNA processing and RNAi mechanisms. ADAR1 differentiates its functions in RNA editing and RNAi by the formation of either ADAR1/ADAR1 homodimer or Dicer/ADAR1 heterodimer complexes, respectively. As expected, the expression of miRNAs is globally inhibited in ADAR1(-/-) mouse embryos, which, in turn, alters the expression of their target genes and might contribute to their embryonic lethal phenotype.","The statement is supported by the information provided in Context [1]. It is mentioned that ADAR1 forms a complex with Dicer and increases the maximum rate (Vmax) of pre-microRNA (miRNA) cleavage by Dicer. Therefore, ADAR1 does indeed bind to Dicer to facilitate the cleavage of pre-miRNA."
50,AIRE is expressed in some skin tumors.,"['Keratin-dependent regulation of Aire and gene expression in skin tumor keratinocytes Expression of the intermediate filament protein keratin 17 (K17) is robustly upregulated in inflammatory skin diseases and in many tumors originating in stratified and pseudostratified epithelia. We report that autoimmune regulator (Aire), a transcriptional regulator, is inducibly expressed in human and mouse tumor keratinocytes in a K17-dependent manner and is required for timely onset of Gli2-induced skin tumorigenesis in mice. The induction of Aire mRNA in keratinocytes depends on a functional interaction between K17 and the heterogeneous nuclear ribonucleoprotein hnRNP K. Further, K17 colocalizes with Aire protein in the nucleus of tumor-prone keratinocytes, and each factor is bound to a specific promoter region featuring an NF-κB consensus sequence in a relevant subset of K17- and Aire-dependent proinflammatory genes. These findings provide radically new insight into keratin intermediate filament and Aire function, along with a molecular basis for the K17-dependent amplification of inflammatory and immune responses in diseased epithelia.', 'Aire deficiency promotes TRP-1-specific immune rejection of melanoma. The thymic transcription factor autoimmune regulator (Aire) prevents autoimmunity in part by promoting expression of tissue-specific self-antigens, which include many cancer antigens. For example, AIRE-deficient patients are predisposed to vitiligo, an autoimmune disease of melanocytes that is often triggered by efficacious immunotherapies against melanoma. Therefore, we hypothesized that Aire deficiency in mice may elevate immune responses to cancer and provide insights into how such responses might be triggered. In this study, we show that Aire deficiency decreases thymic expression of TRP-1 (TYRP1), which is a self-antigen in melanocytes and a cancer antigen in melanomas. Aire deficiency resulted in defective negative selection of TRP-1-specific T cells without affecting thymic numbers of regulatory T cells. Aire-deficient mice displayed elevated T-cell immune responses that were associated with suppression of melanoma outgrowth. Furthermore, transplantation of Aire-deficient thymic stroma was sufficient to confer more effective immune rejection of melanoma in an otherwise Aire wild-type host. Together, our work showed how Aire deficiency can enhance immune responses against melanoma and how manipulating TRP-1-specific T-cell negative selection may offer a logical strategy to enhance immune rejection of melanoma.', 'Acids: Structures, Properties, and Functions (University Science Books, Sausalito, CA, 2000). Humans expressing a defective form of the transcription factor AIRE (autoimmune regulator) develop multiorgan autoimmune disease. We used aire- deficient mice to test the hypothesis that this transcription factor regulates autoimmunity by promoting the ectopic expression of peripheral tissue- restricted antigens in medullary epithelial cells of the thymus. This hypothesis proved correct. The mutant animals exhibited a defined profile of autoimmune diseases that depended on the absence of aire in stromal cells of the thymus. Aire-deficient thymic medullary epithelial cells showed a specific reduction in ectopic transcription of genes encoding peripheral antigens. These findings highlight the importance of thymically imposed ""central"" tolerance in controlling autoimmunity.', 'The Immune Response to Melanoma Is Limited by Thymic Selection of Self-Antigens The expression of melanoma-associated antigens (MAA) being limited to normal melanocytes and melanomas, MAAs are ideal targets for immunotherapy and melanoma vaccines. As MAAs are derived from self, immune responses to these may be limited by thymic tolerance. The extent to which self-tolerance prevents efficient immune responses to MAAs remains unknown. The autoimmune regulator (AIRE) controls the expression of tissue-specific self-antigens in thymic epithelial cells (TECs). The level of antigens expressed in the TECs determines the fate of auto-reactive thymocytes. Deficiency in AIRE leads in both humans (APECED patients) and mice to enlarged autoreactive immune repertoires. Here we show increased IgG levels to melanoma cells in APECED patients correlating with autoimmune skin features. Similarly, the enlarged T cell repertoire in AIRE(-/-) mice enables them to mount anti-MAA and anti-melanoma responses as shown by increased anti-melanoma antibodies, and enhanced CD4(+) and MAA-specific CD8(+) T cell responses after melanoma challenge. We show that thymic expression of gp100 is under the control of AIRE, leading to increased gp100-specific CD8(+) T cell frequencies in AIRE(-/-) mice. TRP-2 (tyrosinase-related protein), on the other hand, is absent from TECs and consequently TRP-2 specific CD8(+) T cells were found in both AIRE(-/-) and AIRE(+/+) mice. This study emphasizes the importance of investigating thymic expression of self-antigens prior to their inclusion in vaccination and immunotherapy strategies.', 'Control of central and peripheral tolerance by Aire. The negative selection of self-reactive thymocytes depends on the expression of tissue-specific antigens by medullary thymic epithelial cells. The autoimmune regulator (Aire) protein plays an important role in turning on these antigens, and the absence of even one Aire-induced tissue-specific antigen in the thymus can lead to autoimmunity in the antigen-expressing target organ. Recently, Aire protein has been detected in peripheral lymphoid organs, suggesting that peripheral Aire plays a complementary role here. In these peripheral sites, Aire was found to regulate the expression of a group of tissue-specific antigens that is distinct from those expressed in the thymus. Furthermore, transgenic antigen expression in extrathymic Aire-expressing cells (eTACs) can mediate deletional tolerance, but the immunological relevance of Aire-dependent, endogenous tissue-specific antigens remains to be determined.']","Keratin-dependent regulation of Aire and gene expression in skin tumor keratinocytes: Expression of the intermediate filament protein keratin 17 (K17) is robustly upregulated in inflammatory skin diseases and in many tumors originating in stratified and pseudostratified epithelia. We report that autoimmune regulator (Aire), a transcriptional regulator, is inducibly expressed in human and mouse tumor keratinocytes in a K17-dependent manner and is required for timely onset of Gli2-induced skin tumorigenesis in mice. The induction of Aire mRNA in keratinocytes depends on a functional interaction between K17 and the heterogeneous nuclear ribonucleoprotein hnRNP K. Further, K17 colocalizes with Aire protein in the nucleus of tumor-prone keratinocytes, and each factor is bound to a specific promoter region featuring an NF-κB consensus sequence in a relevant subset of K17- and Aire-dependent proinflammatory genes. These findings provide radically new insight into keratin intermediate filament and Aire function, along with a molecular basis for the K17-dependent amplification of inflammatory and immune responses in diseased epithelia.","The provided contexts do not directly state that AIRE is expressed in some skin tumors. However, Context [1] discusses the inducible expression of Aire in human and mouse tumor keratinocytes in a K17-dependent manner and its role in the timely onset of Gli2-induced skin tumorigenesis in mice. This suggests that Aire is involved in the regulation of gene expression"
51,ALDH1 expression is associated with better breast cancer outcomes.,"['ALDH1 is a marker of normal and malignant human mammary stem cells and a predictor of poor clinical outcome. Application of stem cell biology to breast cancer research has been limited by the lack of simple methods for identification and isolation of normal and malignant stem cells. Utilizing in vitro and in vivo experimental systems, we show that normal and cancer human mammary epithelial cells with increased aldehyde dehydrogenase activity (ALDH) have stem/progenitor properties. These cells contain the subpopulation of normal breast epithelium with the broadest lineage differentiation potential and greatest growth capacity in a xenotransplant model. In breast carcinomas, high ALDH activity identifies the tumorigenic cell fraction, capable of self-renewal and of generating tumors that recapitulate the heterogeneity of the parental tumor. In a series of 577 breast carcinomas, expression of ALDH1 detected by immunostaining correlated with poor prognosis. These findings offer an important new tool for the study of normal and malignant breast stem cells and facilitate the clinical application of stem cell concepts.', 'Oxidative stress in cancer associated fibroblasts drives tumor-stroma co-evolution: A new paradigm for understanding tumor metabolism, the field effect and genomic instability in cancer cells. Loss of stromal fibroblast caveolin-1 (Cav-1) is a powerful single independent predictor of poor prognosis in human breast cancer patients, and is associated with early tumor recurrence, lymph node metastasis and tamoxifen-resistance. We developed a novel co-culture system to understand the mechanism(s) by which a loss of stromal fibroblast Cav-1 induces a ""lethal tumor micro-environment. "" Here, we propose a new paradigm to explain the powerful prognostic value of stromal Cav-1. In this model, cancer cells induce oxidative stress in cancer-associated fibroblasts, which then acts as a ""metabolic"" and ""mutagenic"" motor to drive tumor-stroma co-evolution, DNA damage and aneuploidy in cancer cells. More specifically, we show that an acute loss of Cav-1 expression leads to mitochondrial dysfunction, oxidative stress and aerobic glycolysis in cancer associated fibroblasts. Also, we propose that defective mitochondria are removed from cancer-associated fibroblasts by autophagy/mitophagy that is induced by oxidative stress. As a consequence, cancer associated fibroblasts provide nutrients (such as lactate) to stimulate mitochondrial biogenesis and oxidative metabolism in adjacent cancer cells (the ""Reverse Warburg Effect""). We provide evidence that oxidative stress in cancer-associated fibroblasts is sufficient to induce genomic instability in adjacent cancer cells, via a bystander effect, potentially increasing their aggressive behavior. Finally, we directly demonstrate that nitric oxide (NO) over-production, secondary to Cav-1 loss, is the root cause for mitochondrial dysfunction in cancer associated fibroblasts. In support of this notion, treatment with anti-oxidants (such as N-acetyl-cysteine, metformin and quercetin) or NO inhibitors (L-NAME) was sufficient to reverse many of the cancer-associated fibroblast phenotypes that we describe. Thus, cancer cells use ""oxidative stress"" in adjacent fibroblasts (i) as an ""engine"" to fuel their own survival via the stromal production of nutrients and (ii) to drive their own mutagenic evolution towards a more aggressive phenotype, by promoting genomic instability. We also present evidence that the ""field effect"" in cancer biology could also be related to the stromal production of ROS and NO species. eNOS-expressing fibroblasts have the ability to downregulate Cav-1 and induce mitochondrial dysfunction in adjacent fibroblasts that do not express eNOS. As such, the effects of stromal oxidative stress can be laterally propagated, amplified and are effectively ""contagious""--spread from cell-to-cell like a virus--creating an ""oncogenic/mutagenic"" field promoting widespread DNA damage.', 'Tamoxifen resistance in MCF7 cells promotes EMT-like behaviour and involves modulation of beta-catenin phosphorylation. We have previously demonstrated that, following acquisition of endocrine resistance, breast cancer cells display an altered growth rate together with increased aggressive behaviour in vitro. Since dysfunctional cell-cell adhesive interactions can promote an aggressive phenotype, we investigated the integrity of this protein complex in our breast cancer model of tamoxifen resistance. In culture, tamoxifen-resistant MCF7 (TamR) cells grew as loosely packed colonies with loss of cell-cell junctions and demonstrated altered morphology characteristic of cells undergoing epithelial-to-mesenchymal transition (EMT). Neutralising E-cadherin function promoted the invasion and inhibited the aggregation of endocrine-sensitive MCF7 cells, whilst having little effect on the behaviour of TamR cells. Additionally, TamR cells had increased levels of tyrosine-phosphorylated beta-catenin, whilst serine/threonine-phosphorylated beta-catenin was decreased. These cells also displayed loss of association between beta-catenin and E-cadherin, increased cytoplasmic and nuclear beta-catenin and elevated transcription of beta-catenin target genes known to be involved in tumour progression and EMT. Inhibition of EGFR kinase activity in TamR cells reduced beta-catenin tyrosine phosphorylation, increased beta-catenin-E-cadherin association and promoted cell-cell adhesion. In such treated cells, the association of beta-catenin with Lef-1 and the transcription of c-myc, cyclin-D1, CD44 and COX-2 were also reduced. These results suggest that homotypic adhesion in tamoxifen-resistant breast cancer cells is dysfunctional due to EGFR-driven modulation of the phosphorylation status of beta-catenin and may contribute to an enhanced aggressive phenotype and transition towards a mesenchymal phenotype in vitro.', 'Age- and sex-specific genomic profiles in non-small cell lung cancer. CONTEXT Gene expression profiling may be useful in examining differences underlying age- and sex-specific outcomes in non-small cell lung cancer (NSCLC). OBJECTIVE To describe clinically relevant differences in the underlying biology of NSCLC based on patient age and sex. DESIGN, SETTING, AND PATIENTS Retrospective analysis of 787 patients with predominantly early stage NSCLC performed at Duke University, Durham, North Carolina, from July 2008 to June 2009. Lung tumor samples with corresponding microarray and clinical data were used. All patients were divided into subgroups based on age (< 70 vs > or = 70 years old) or sex. Gene expression signatures representing oncogenic pathway activation and tumor biology/microenvironment status were applied to these samples to obtain patterns of activation/deregulation. MAIN OUTCOME MEASURES Patterns of oncogenic and molecular signaling pathway activation that are reproducible and correlate with 5-year recurrence-free patient survival. RESULTS Low- and high-risk patient clusters/cohorts were identified with the longest and shortest 5-year recurrence-free survival, respectively, within the age and sex NSCLC subgroups. These cohorts of NSCLC demonstrate similar patterns of pathway activation. In patients younger than 70 years, high-risk patients, with the shortest recurrence-free survival, demonstrated increased activation of the Src (25% vs 6%; P<.001) and tumor necrosis factor (76% vs 42%; P<.001) pathways compared with low-risk patients. High-risk patients aged 70 years or older demonstrated increased activation of the wound healing (40% vs 24%; P = .02) and invasiveness (64% vs 20%; P<.001) pathways compared with low-risk patients. In women, high-risk patients demonstrated increased activation of the invasiveness (99% vs 2%; P<.001) and STAT3 (72% vs 35%; P<.001) pathways while high-risk men demonstrated increased activation of the STAT3 (87% vs 18%; P<.001), tumor necrosis factor (90% vs 46%; P<.001), EGFR (13% vs 2%; P = .003), and wound healing (50% vs 22%; P<.001) pathways. Multivariate analyses confirmed the independent clinical relevance of the pathway-based subphenotypes in women (hazard ratio [HR], 2.02; 95% confidence interval [CI], 1.34-3.03; P<.001) and patients younger than 70 years (HR, 1.83; 95% CI, 1.24-2.71; P = .003). All observations were reproducible in split sample analyses. CONCLUSIONS Among a cohort of patients with NSCLC, subgroups defined by oncogenic pathway activation profiles were associated with recurrence-free survival. These findings require validation in independent patient data sets.', 'Gene–environment interactions in 7610 women with breast cancer: prospective evidence from the Million Women Study BACKGROUND Information is scarce about the combined effects on breast cancer incidence of low-penetrance genetic susceptibility polymorphisms and environmental factors (reproductive, behavioural, and anthropometric risk factors for breast cancer). To test for evidence of gene-environment interactions, we compared genotypic relative risks for breast cancer across the other risk factors in a large UK prospective study. METHODS We tested gene-environment interactions in 7610 women who developed breast cancer and 10 196 controls without the disease, studying the effects of 12 polymorphisms (FGFR2-rs2981582, TNRC9-rs3803662, 2q35-rs13387042, MAP3K1-rs889312, 8q24-rs13281615, 2p-rs4666451, 5p12-rs981782, CASP8-rs1045485, LSP1-rs3817198, 5q-rs30099, TGFB1-rs1982073, and ATM-rs1800054) in relation to prospectively collected information about ten established environmental risk factors (age at menarche, parity, age at first birth, breastfeeding, menopausal status, age at menopause, use of hormone replacement therapy, body-mass index, height, and alcohol consumption). FINDINGS After allowance for multiple testing none of the 120 comparisons yielded significant evidence of a gene-environment interaction. By contrast with previous suggestions, there was little evidence that the genotypic relative risks were affected by use of hormone replacement therapy, either overall or for oestrogen-receptor-positive disease. Only one of the 12 polymorphisms was correlated with any of the ten other risk factors: carriers of the high-risk C allele of MAP3K1-rs889312 were significantly shorter than non-carriers (mean height 162.4 cm [95% CI 162.1-162.7] vs 163.1 cm [162.9-163.2]; p=0.01 after allowance for multiple testing). INTERPRETATION Risks of breast cancer associated with low-penetrance susceptibility polymorphisms do not vary significantly with these ten established environmental risk factors. FUNDING Cancer Research UK and the UK Medical Research Council.']","ALDH1 is a marker of normal and malignant human mammary stem cells and a predictor of poor clinical outcome.: Application of stem cell biology to breast cancer research has been limited by the lack of simple methods for identification and isolation of normal and malignant stem cells. Utilizing in vitro and in vivo experimental systems, we show that normal and cancer human mammary epithelial cells with increased aldehyde dehydrogenase activity (ALDH) have stem/progenitor properties. These cells contain the subpopulation of normal breast epithelium with the broadest lineage differentiation potential and greatest growth capacity in a xenotransplant model. In breast carcinomas, high ALDH activity identifies the tumorigenic cell fraction, capable of self-renewal and of generating tumors that recapitulate the heterogeneity of the parental tumor. In a series of 577 breast carcinomas, expression of ALDH1 detected by immunostaining correlated with poor prognosis. These findings offer an important new tool for the study of normal and malignant breast stem cells and facilitate the clinical application of stem cell concepts.","The evidence provided does not support the claim that ALDH1 expression is associated with better breast cancer outcomes. In fact, the first context indicates the opposite: ""In a series of 577 breast carcinomas, expression of ALDH1 detected by immunostaining correlated with poor prognosis."" Therefore, ALDH1 expression is associated with poor clinical outcomes in breast cancer."
